{
  "schema_version": 1,
  "command_id": "33333333-3333-4333-8333-333333333333",
  "action": "deploy",
  "app_id": "11111111-1111-4111-8111-111111111111",
  "deployment_id": "44444444-4444-4444-8444-444444444444",
  "worker_id": "55555555-5555-4555-8555-555555555555",
  "generation": 1,
  "expires_at": "2030-01-01T00:02:00Z",
  "nonce": "aaaaaaaaaaaaaaaaaaaaaaaaaaaaaaaaaaaaaaaaaaaaaaaaaaaaaaaaaaaaaaaa",
  "policy_hash": "sha256:aaaaaaaaaaaaaaaaaaaaaaaaaaaaaaaaaaaaaaaaaaaaaaaaaaaaaaaaaaaaaaaa",
  "key_id": "test-key",
  "signature": "AAAAAAAAAAAAAAAAAAAAAAAAAAAAAAAAAAAAAAAAAAAAAAAAAAAAAAAAAAAAAAAAAAAAAAAAAAAAAAAAAAAAAA==",
  "spec": {
    "profile": "restricted-v1",
    "services": [
      {
        "name": "web",
        "image": "registry.example.org/apps/inventory@sha256:aaaaaaaaaaaaaaaaaaaaaaaaaaaaaaaaaaaaaaaaaaaaaaaaaaaaaaaaaaaaaaaa",
        "uid": 10001,
        "gid": 10001,
        "resources": {
          "cpu_millis": 1000,
          "memory_bytes": 536870912,
          "pids": 128,
          "tmp_bytes": 67108864,
          "writable_bytes": 1073741824,
          "log_bytes": 20971520
        }
      }
    ],
    "ingress": {"service": "web", "port": 8080, "health_path": "/health"}
  }
}
